PT,AU,BA,BE,GP,AF,BF,CA,TI,SO,SE,BS,LA,DT,CT,CY,CL,SP,HO,DE,ID,AB,C1,RP,EM,RI,OI,FU,FX,CR,NR,TC,Z9,U1,U2,PU,PI,PA,SN,EI,BN,J9,JI,PD,PY,VL,IS,PN,SU,SI,MA,BP,EP,AR,DI,D2,EA,PG,WC,SC,GA,UT,PM,OA,HC,HP,DA
J,"Al-Laham, A; Tzabbar, D; Amburgey, TL",,,,"Al-Laham, Andreas; Tzabbar, Daniel; Amburgey, Terry L.",,,The dynamics of knowledge stocks and knowledge flows: innovation consequences of recruitment and collaboration in biotech,INDUSTRIAL AND CORPORATE CHANGE,,,,,,,,,,,,"To extend the knowledge-based view of the firm, we examine how managing the dynamic balance that a firm must undertake between applying knowledge stocks and accessing knowledge flows may determine innovativeness. We found that while the effect of scientist's recruitment and alliances as two sources of knowledge flow decay overtime, high degrees of human and social capital stock reduces the speed of new assets erosion. Failing to account for the interactions between knowledge stocks and flows, as well as the underlining causalities associated with each knowledge source, will result in an incomplete picture of the relationship between knowledge development efforts and innovative success. We test our assumptions on a longitudinal event history data set of the complete US biotech population of 857 firms founded during the period 1973-1999.",,,,,,,,,,,,,,,,,0960-6491,,,,,APR,2011,20,2,,,,,555,583,,10.1093/icc/dtr001,,,,,,,WOS:000289166600006,,,,,
J,"Caniels, MCJ; Romijn, HA",,,,"Caniels, Marjolein C. J.; Romijn, Henny A.",,,Actor networks in Strategic Niche Management: Insights from social network theory,FUTURES,,,,,,,,,,,,"This paper contributes to Strategic Niche Management (SNM), an analytical technique designed to facilitate the introduction and diffusion of radically new sustainable technologies through societal experiments. According to SNM, intensive networking among social actors is a crucial process for the successful incubation of new technologies. However, the manner in which innovation success relates to different characteristics pertaining to the structure and functioning of these actor networks has remained rather unclear. In this paper we open up this 'black box' by bringing in social network analysis (SNA), which allows for a more systematic analysis of this issue. We review theoretical SNA contributions that shed light on the link between actor network attributes and innovation outcomes. Then we elaborate a case study about the emerging biofuels sector in Tanzania. After analysing the case from a conventional SNM perspective, we apply SNA techniques to generate more in-depth insights into the composition and functioning of the actor network and how this affects the innovation performance and development prospects of the sector. Policy implications are also discussed. (C) 2007 Elsevier Ltd. All rights reserved.",,,,,"Caniels, Marjolein/0000-0002-4206-4083",,,,,,,,,,,,0016-3287,,,,,SEP,2008,40,7,,,,,613,629,,10.1016/j.futures.2007.12.005,,,,,,,WOS:000257980800002,,,,,
J,"Parag, Y; Hamilton, J; White, V; Hogan, B",,,,"Parag, Yael; Hamilton, Jo; White, Vicki; Hogan, Bernie",,,Network approach for local and community governance of energy: The case of Oxfordshire,ENERGY POLICY,,,,,,,,,,,,"One of the many barriers to the incorporation of local and community actors in emerging energy governance structures and policy delivery mechanisms is the lack of thorough understanding of how they work in practice, and how best to support and develop effective local energy governance. Taking a meso-level perspective and a network approach to governance, this paper sheds some new light on this issue, by focusing on the relation, channels of communication and interactions between low carbon community groups (LCCGs) and other actors. Based on data gathered from LCCGs in Oxfordshire, UK, via network survey and interviews the research maps the relations in terms of the exchanges of information and financial support, and presents a relation-based structure of local energy governance. Analysis reveals the intensity of energy related information exchanges that is taking place at the county level and highlights the centrality of intermediary organization in facilitating information flow. The analysis also identifies actors that are not very dominant in their amount of exchanges, but fill 'weak-tie' functions between otherwise disconnected LCCGs or other actors in the network. As an analytical tool the analysis could be useful for various state and non-state actors that want to better understand and support financially and otherwise actors that enable energy related local action. (C) 2013 Elsevier Ltd. All rights reserved.",,,,,"Hamilton, Jo/0000-0003-3888-8298",,,,,,,,,,,,0301-4215,1873-6777,,,,NOV,2013,62,,,,,,1064,1077,,10.1016/j.enpol.2013.06.027,,,,,,,WOS:000326770300108,,,,,
J,"Healy, A; Morgan, K",,,,"Healy, Adrian; Morgan, Kevin",,,"Spaces of Innovation: Learning, Proximity and the Ecological Turn",REGIONAL STUDIES,,,,,,,,,,,,"HEALY A. and MORGAN K. Spaces of innovation: learning, proximity and the ecological turn, Regional Studies. Contrary to the fashionable 'death of distance' thesis, the socio-spatial context for innovation remains as important as ever for firms, networks and the public institutions that tend to be neglected in orthodox narratives of learning. This article explores the changing socio-spatial dynamics of innovation through the medium of three arguments: (1) that the 'Learning Region' debate was worth having because it triggered a fruitful dialogue between innovation theorists and economic geographers; (2) that geographical proximity remains a powerful explanatory concept; and (3) that 'the ecological turn' challenges conventional conceptions of learning, innovation and development.",,,,,,,,,,,,,,,,,0034-3404,,,,,,2012,46,8,,,SI,,1041,1053,,10.1080/00343404.2012.672725,,,,,,,WOS:000308075100005,,,,,
J,"Devillanova, C",,,,"Devillanova, Carlo",,,"Social networks, information and health care utilization: Evidence from undocumented immigrants in Milan",JOURNAL OF HEALTH ECONOMICS,,,,,,,,,,,,"This paper uses a novel dataset and research design to examine the effects of information networks on immigrants' access to health care. The dataset consists of an unusually large sample of undocumented immigrants and contains a direct indicator of information networks-whether an immigrant was referred to health care opportunities by a strong social tie (relative or friend). This measure allows to overcome some of the major identification issues that afflict most of the existing literature on network effects and to concentrate on one of the channels through which social contacts might operate. The analysis focuses on the time spent in Italy before an immigrant first receives medical assistance. Estimates indicate that networks significantly foster health care utilization: after controlling for all available individual characteristics and for ethnic heterogeneity, I find that relying on a strong social tie reduces the time to visit by 30%. The effect of information networks is stable across specifications and it is relatively large. Further investigation seems to confirm the quantitative importance of networks as an information device. (C) 2007 Elsevier B.V. All rights reserved.",,,,,,,,,,,,,,,,,0167-6296,,,,,MAR,2008,27,2,,,,,265,286,,10.1016/j.jhealeco.2007.08.006,,,,,,,WOS:000255138900006,18242742,,,,
J,"El-Khatib, R; Fogel, K; Jandik, T",,,,"El-Khatib, Rwan; Fogel, Kathy; Jandik, Tomas",,,CEO network centrality and merger performance,JOURNAL OF FINANCIAL ECONOMICS,,,,,,,,,,,,"We study the effects on M&A outcomes of CEO network centrality, which measures the extent and strength of a CEO's personal connections. High network centrality can allow CEOs to efficiently gather and control private information, facilitating value-creating acquisition decisions. We show, however, that M&A deals initiated by high-centrality CEOs, in addition to being more frequent, carry greater value losses to both the acquirer and the combined entity than deals initiated by low-centrality CEOs. We also document that high-centrality CEOs are capable of avoiding the discipline of the markets for corporate control and the executive labor market, and that the mitigating effect of internal governance on CEO actions is limited. Our evidence suggests that corporate decisions can be influenced by a CEO's position in the social hierarchy, with high-centrality CEOs using their power and influence to increase entrenchment and reap private benefits. (C) 2015 Elsevier B.V. All rights reserved.",,,,,"El-Khatib, Rwan/0000-0002-3113-5456",,,,,,,,,,,,0304-405X,,,,,MAY,2015,116,2,,,,,349,382,,10.1016/j.jfineco.2015.01.001,,,,,,,WOS:000354831100008,,,,,
J,"Wohlgemuth, M",,,,"Wohlgemuth, M",,,Evolutionary approaches to politics,KYKLOS,,,,,Conference on Innovations in Political Economics and Political Institutions,"Jan, 2001","LUGANO, SWITZERLAND",Civil Soc Assoc Switzerland,,,,"Evolutionary approaches to politics are rare; especially where they could rival mainstream Public Choice: as positive theories of normal politics. With Schumpeter and Hayek, two protagonists of evolutionary thinking have dealt with political competition. Their concepts of political entrepreneurship and opinion formation remain rudimentary; but they point at important issues that mainstream public choice tends to ignore and evolutionary approaches tend to stress. We analyse politics as a compound of variety-creating processes of entrepreneurial rivalry and feedback-creating selection processes. Important parallels and differences become visible not only compared to capitalistic market processes, but also between various dimensions of political competition. Compared to pure representative democracy, direct democracy and inter-jurisdictional competition show characteristics that evolutionary approaches reveal more easily than rational choice equilibrium models. This relates to (a) the discovery and social use of dispersed knowledge and skills; (b) political entrepreneurs' creation of (attention for) issues for public opinion; (c) parallel learning from choices of rules in interjurisdictional competition; (d) political barriers to entry and innovations in politics. It is shown that evolutionary concepts such as entrepreneurial creation or competition as a discovery procedure can be applied to politics. This is not to ignore fundamental differences to spontaneous market processes - on the contrary, by identifying such differences evolutionary approaches can make valuable contributions to comparative institutional analysis.",,,,,,,,,,,,,,,,,0023-5962,,,,,,2002,55,2,,,,,223,246,,10.1111/1467-6435.00184,,,,,,,WOS:000175954600005,,,,,
J,"Cai, J; De Janvry, A; Sadoulet, E",,,,"Cai, Jing; De Janvry, Alain; Sadoulet, Elisabeth",,,Social Networks and the Decision to Insure,AMERICAN ECONOMIC JOURNAL-APPLIED ECONOMICS,,,,,,,,,,,,"the influence of social networks on weather insurance adoption and the mechanisms through which they operate. To quantify network effects, the experiment provides intensive information sessions about the product to a random subset of farmers. For untreated farmers, the effect of having an additional treated friend on take-up is equivalent to granting a 13 percent reduction in the insurance premium. By varying the information available about peers' decisions and randomizing default options, we show that the network effect is driven by the diffusion of insurance knowledge rather than purchase decisions.",,,,"Cai, Jing/B-1348-2018",,,,,,,,,,,,,1945-7782,1945-7790,,,,APR,2015,7,2,,,,,81,108,,10.1257/app.20130442,,,,,,,WOS:000351932800004,,,,,
J,"Patacchini, E; Zenou, Y",,,,"Patacchini, Eleonora; Zenou, Yves",,,Juvenile Delinquency and Conformism,JOURNAL OF LAW ECONOMICS & ORGANIZATION,,,,,,,,,,,,"This article studies whether conformism behavior affects individual outcomes in crime. We present a social network model of peer effects with ex ante heterogeneous agents and show how conformism and deterrence affect criminal activities. We then bring the model to the data by using a very detailed data set of adolescent friendship networks. A novel social network-based empirical strategy allows us to identify peer effects for different types of crimes. We find that conformity plays an important role for all crimes, especially for petty crimes. This suggests that, for juvenile crime, an effective policy should be measured not only by the possible crime reduction it implies but also by the group interactions it engenders.",,,,,"Zenou, Yves/0000-0001-6516-0812",,,,,,,,,,,,8756-6222,1465-7341,,,,APR,2012,28,1,,,,,1,31,,10.1093/jleo/ewp038,,,,,,,WOS:000300438400001,,,,,
B,"Julien, PA",,,,"Julien, P. A.",,,Theory of Local Entrepreneurship in the Knowledge Economy,THEORY OF LOCAL ENTREPRENEURSHIP IN THE KNOWLEDGE ECONOMY,,,,,,,,,,,,,,,,,,,,,,,,,,,,,,,978-1-84720-388-5,,,,2007,,,,,,,1,322,,,,,,,,,WOS:000288203400017,,,,,
B,"Swedberg, R",,"Smelser, NJ; Swedberg, R",,"Swedberg, Richard",,,Markets in Society,"HANDBOOK OF ECONOMIC SOCIOLOGY, SECOND EDITION",,,,,,,,,,,,,,,,,,,,,,,,,,,,,,,978-0-691-12125-3,,,,2005,,,,,,,233,253,,,,,,,,,WOS:000287573700012,,,,,
J,"Asheim, B; Dunford, M",,,,"Asheim, B; Dunford, M",,,Regional futures,REGIONAL STUDIES,,,,,,,,,,,,,,,,"Dunford, Michael/J-8306-2019","Dunford, Michael/0000-0002-0028-3130",,,,,,,,,,,,0034-3404,,,,,JUL,1997,31,5,,,,,445,455,,10.1080/00343409750132243,,,,,,,WOS:A1997XM46700001,,,,,
J,"Davern, M",,,,"Davern, M",,,Social networks and economic sociology: A proposed research agenda for a more complete social science,AMERICAN JOURNAL OF ECONOMICS AND SOCIOLOGY,,,,,,,,,,,,"The social network metaphor is widely used by sociologists to study socioeconomic behavior and processes. The use of social networks generally takes place within the ranks of sociology, However, a more complete social science would result by combining work being done on social networks within sociology with mainline economic theory. The insights from such a research agenda will help us better understand socioeconomic behavior. With this in mind, the main objective of this paper is to demonstrate the utility of the network metaphor to economists. This objective will be accomplished through developing four basic components of social networks, and using them to navigate through the existing literature in economic sociology, Furthermore, topics for future research in which social networks can provide contributions to the explanation of socioeconomic behavior are explored as well.",,,,,,,,,,,,,,,,,0002-9246,,,,,JUL,1997,56,3,,,,,287,302,,10.1111/j.1536-7150.1997.tb03359.x,,,,,,,WOS:A1997XU84300003,,,,,
J,"Burks, SV; Cowgill, B; Hoffman, M; Housman, M",,,,"Burks, Stephen V.; Cowgill, Bo; Hoffman, Mitchell; Housman, Michael",,,THE VALUE OF HIRING THROUGH EMPLOYEE REFERRALS,QUARTERLY JOURNAL OF ECONOMICS,,,,,,,,,,,,"Using personnel data from nine large firms in three industries (call centers, trucking, and high-tech), we empirically assess the benefit to firms of hiring through employee referrals. Compared to nonreferred applicants, referred applicants are more likely to be hired and more likely to accept offers, even though referrals and nonreferrals have similar skill characteristics. Referred workers tend to have similar productivity compared to nonreferred workers on most measures, but referred workers have lower accident rates in trucking and produce more patents in high-tech. Referred workers are substantially less likely to quit and earn slightly higher wages than nonreferred workers. In call centers and trucking, the two industries for which we can calculate worker-level profits, referred workers yield substantially higher profits per worker than nonreferred workers. These profit differences are driven by lower turnover and lower recruiting costs for referrals.",,,,"Cowgill, Bo/Q-2760-2015","Cowgill, Bo/0000-0002-2525-2306; Burks, Stephen/0000-0003-4524-2954",,,,,,,,,,,,0033-5533,1531-4650,,,,MAY,2015,130,2,,,,,805,839,,10.1093/qje/qjv010,,,,,,,WOS:000354733000007,,,,,
J,"Gluckler, J",,,,"Glueckler, Johannes",,,"Knowledge, Networks and Space: Connectivity and the Problem of Non-Interactive Learning",REGIONAL STUDIES,,,,,,,,,,,,"Gluckler J. Knowledge, networks and space: connectivity and the problem of non-interactive learning, Regional Studies. This paper develops an integrative perspective of network theory and economic geography to attain a more inclusive understanding of the creation and reproduction of knowledge. A sympathetic review of network research in the social sciences conveys that geography is often a marginalized factor and that the empirical evidence about its effect on networks and knowledge has been ambiguous. The paper criticizes network theory for its tendency to overlook processes of collective learning that happen outside networks. By conceptualizing non-interactive learning, it posits that an inclusive theory of knowledge has to integrate network accounts of interactions and geographical accounts of non-interactive learning.",,,,"Gluckler, Johannes/K-3807-2018","Gluckler, Johannes/0000-0002-2507-1556",,,,,,,,,,,,0034-3404,1360-0591,,,,Jun 1,2013,47,6,,,SI,,880,894,,10.1080/00343404.2013.779659,,,,,,,WOS:000319552700005,,,,,
J,"Apinunmahakul, A; Devlin, RA",,,,"Apinunmahakul, Amornrat; Devlin, Rose Anne",,,Social networks and private philanthropy,JOURNAL OF PUBLIC ECONOMICS,,,,,,,,,,,,"A theoretical model is provided in which an individual's social network enhances the consumption benefits from the public good. We find conditions under which investments in network enhancing infrastructure would encourage individuals to donate time and money to charity. An empirical investigation of the link between networks and private philanthropy is undertaken using the Canadian National Survey of Giving, Volunteering and Participating. We find strong evidence that networks promote donations of time and money. (C) 2007 Elsevier B.V. All rights reserved.",,,,,,,,,,,,,,,,,0047-2727,,,,,FEB,2008,92,1-2,,,,,309,328,,10.1016/j.jpubeco.2007.07.005,,,,,,,WOS:000253059900014,,,,,
J,"Locke, RM; Romis, M",,,,"Locke, Richard M.; Romis, Monica",,,The promise and perils of private voluntary regulation: Labor standards and work organization in two Mexican garment factories,REVIEW OF INTERNATIONAL POLITICAL ECONOMY,,,,,,,,,,,,"What role can corporate codes of conduct play in monitoring compliance with international labor standards and improving working conditions in global supply chains? How does this system of private voluntary regulation relate to other strategies and regulatory approaches aimed at promoting just working conditions in global supply chains? This paper explores the potential and limitations of private voluntary regulation through a detailed matched pair case study of two factories supplying Nike, the world's largest athletic footwear and apparel company. These two factories have many similarities - both are in Mexico, both are in the apparel industry, both produce more or less the same products for Nike (and other brands) and both are subject to the same code of conduct. On the surface, both factories appear to have similar employment (i.e. recruitment, training, remuneration) practices and they receive comparable scores when audited by Nike's compliance staff. However, underlying (and somewhat obscured by) these apparent similarities, significant differences in actual labor conditions exist between these two factories. What drives these differences in working conditions? What does this imply for traditional systems of monitoring and codes of conduct? Field research conducted at these two factories reveals that beyond the code of conduct and various monitoring efforts aimed at enforcing it, workplace conditions and labor standards are shaped by very different patterns of work organization and human resource management policies. The promotion of these alternative work/human resources management practices can complement traditional monitoring efforts in ways that promoted improved labor standards.",,,,,,,,,,,,,,,,,0969-2290,,,,,,2010,17,1,,,,,45,74,PII 919592573,10.1080/09692290902893230,,,,,,,WOS:000275111800003,,,,,
J,"Baumann, A",,,,"Baumann, A",,,Informal labour market governance: the case of the British and German media production industries,WORK EMPLOYMENT AND SOCIETY,,,,,,,,,,,,"This article is concerned with labour market transactions in the occupational labour markets (OLM) of the media production industries of Germany and the UK. In both countries, labour markets are characterized by a high inter-firm mobility of workers and patterns of short-term employment and freelance work. In this environment, missing standards produce uncertainty about skill levels of workers and qualification needs of firms, As a result, co-operation costs increase and opportunism becomes possible. It will be argued that, in the absence of manifest labour market institutions such as apprenticeships or skill certificates, which traditionally safeguard OLM transactions, the use of intermediaries and restriction of access will take over as informal mechanisms for governing the labour market. Labour market data from interviews with media firms in Germany and the UK and from surveys on German and British media professionals, are used in order to test this hypothesis.",,,,,,,,,,,,,,,,,0950-0170,,,,,MAR,2002,16,1,,,,,27,46,,10.1177/09500170222119236,,,,,,,WOS:000175103200002,,,,,
J,"vanDijk, F; vanWinden, F",,,,"vanDijk, F; vanWinden, F",,,Dynamics of social ties and local public good provision,JOURNAL OF PUBLIC ECONOMICS,,,,,,,,,,,,"A model is presented in which social ties between individuals and private contributions to a local public good are interrelated. Ties are formalized by means of utility interdependence, and depend on the history of social interaction, in this case the joint provision of the public good. The resulting dynamic model generates equilibrium Values of the intensity of ties and the private provision level. The impact of public provision on these variables is analyzed. Our results are very different from those obtained with the standard model, where individuals are only interested in the utility from own consumption.",,,,,,,,,,,,,,,,,0047-2727,,,,,JUN,1997,64,3,,,,,323,341,,10.1016/S0047-2727(96)01620-9,,,,,,,WOS:A1997XF75900002,,,,,
J,"Newbert, SL; Tornikoski, ET",,,,"Newbert, Scott L.; Tornikoski, Erno T.",,,Supporter networks and network growth: a contingency model of organizational emergence,SMALL BUSINESS ECONOMICS,,,,,,,,,,,,"Despite the belief that networks are essential to entrepreneurial success, very few studies consider the role of networks in the founding of new organizations. In response, we test the direct and interactive effects of the characteristics of nascent entrepreneurs' supporter networks and network growth on organizational emergence. We find that (1) the governance and content of the supporter network, along with network growth, are important in predicting organizational emergence, and (2) the structure and content of the supporter network may inform the need for network growth. We conclude by discussing the implications of our findings for academics and practitioners.",,,,"Tornikoski, Erno T./G-4865-2013","Tornikoski, Erno T./0000-0002-2108-5483",,,,,,,,,,,,0921-898X,,,,,JUL,2012,39,1,,,,,141,159,,10.1007/s11187-010-9300-9,,,,,,,WOS:000305806800008,,,,,
J,"Eugster, B; Lalive, R; Steinhauer, A; Zweimuller, J",,,,"Eugster, Beatrix; Lalive, Rafael; Steinhauer, Andreas; Zweimueller, Josef",,,The Demand for Social Insurance: Does Culture Matter?,ECONOMIC JOURNAL,,,,,,,,,,,,"Does culture shape the demand for social insurance against risks to health and work? We study this issue across language groups in Switzerland where a language border sharply separates social groups at identical actual levels of publicly provided social insurance. We find substantially stronger support for expansions of social insurance among residents of French, Italian or Romansh-speaking language border municipalities compared with their German-speaking neighbours in adjacent municipalities. Informal insurance does not vary enough to explain stark differences in social insurance but differences in ideology and segmented media markets potentially contribute to the discrepancy in demand for social insurance.",,,,,,,,,,,,,,,,,0013-0133,1468-0297,,,,NOV,2011,121,556,,,,,F413,F448,,10.1111/j.1468-0297.2011.02479.x,,,,,,,WOS:000296972700008,,,,,
J,"Akresh, R",,,,"Akresh, Richard",,,Flexibility of Household Structure Child Fostering Decisions in Burkina Faso,JOURNAL OF HUMAN RESOURCES,,,,,,,,,,,,"Using data I collected in Africa. this paper examines a household's decision to adjust its Size through child fostering, an institution where biological parents temporarily send children to live with other families. Households experiencing negative idiosyncratic income shocks, child gender imbalances, located further front primary schools, or with more ""good"" quality network members (fewer subsistence farmers and unmarried individuals and more educated members) are significantly more likely to send a child. Results reject an overall symmetric fostering model across senders and receivers, but evidence of symmetry is found when the test is restricted to exogenous income shocks and gender imbalances.",,,,,,,,,,,,,,,,,0022-166X,,,,,FAL,2009,44,4,,,,,976,997,,10.1353/jhr.2009.0011,,,,,,,WOS:000271535100007,,,,,
