PT,AU,BA,BE,GP,AF,BF,CA,TI,SO,SE,BS,LA,DT,CT,CY,CL,SP,HO,DE,ID,AB,C1,RP,EM,RI,OI,FU,FX,CR,NR,TC,Z9,U1,U2,PU,PI,PA,SN,EI,BN,J9,JI,PD,PY,VL,IS,PN,SU,SI,MA,BP,EP,AR,DI,D2,EA,PG,WC,SC,GA,UT,PM,OA,HC,HP,DA
J,"Amuedo-Dorantes, C; De la Rica, S",,,,"Amuedo-Dorantes, Catalina; De la Rica, Sara",,,Immigrants' responsiveness to labor market conditions and their impact on regional employment disparities: evidence from Spain,SERIES-JOURNAL OF THE SPANISH ECONOMIC ASSOCIATION,,,,,,,,,,,,"Using data from the Spanish Labor Force Survey (Encuesta de Poblacin Activa) from 1999 through 2007, we explore the role of employment opportunities in explaining the growing immigrant flows of recent years. Subsequently, we investigate whether immigrant inflows have helped reduce regional employment disparities. Our results indicate that immigrants choose to reside in regions with higher employment rates for their particular skills. However, perhaps owing to its recent nature or the ability of the production infrastructure to absorb the increase in immigrant labor, the immigration shock seems to have lowered regional employment rate disparities only temporarily.",,,,"Islam, Md/Q-8401-2018; De la Rica, Sara/H-6637-2015","De la Rica, Sara/0000-0001-9872-6798",,,,,,,,,,,,1869-4187,,,,,SEP,2010,1,4,,,,,387,407,,10.1007/s13209-009-0002-y,,,,,,,WOS:000282171500002,,,,,
J,"Mendez-Duron, R; Garcia, CE",,,,"Mendez-Duron, Rebeca; Garcia, Clara E.",,,Returns from social capital in open source software networks,JOURNAL OF EVOLUTIONARY ECONOMICS,,,,,5th European Meeting on Applied Evolutionary Economics,"MAY 17-19, 2007","Manchester Metropolitan Univ, Manchester, ENGLAND",,Manchester Metropolitan Univ,,,"Open Source Software projects base their operation on a collaborative structure for knowledge exchange in the form of provision or reception of information, expertise and feedback on the creation of source code. Here, we address the direction of these knowledge flows among projects throughout social networks and their impact on project success. We identify the roles of membership or contribution that individuals play within projects. We found that connections through contributors who bring their knowledge to the project, improve project success, and that connection through members, who transfer their knowledge towards other projects, enhance project success. Finally, we found that ties through shared membership and contributions hamper project success. The analysis of knowledge flows and their impact on project success imply a translation of returns from investment in social capital, where investment takes the shape of knowledge flows and the returns mean the projects' diffusion over the network.",,,,"Mendez-Duron, Rebeca/F-6750-2016","Mendez-Duron, Rebeca/0000-0001-5970-5070",,,,,,,,,,,,0936-9937,1432-1386,,,,APR,2009,19,2,,,,,277,295,,10.1007/s00191-008-0125-5,,,,,,,WOS:000263797500007,,,,,
J,"Rainer, H; Siedler, T",,,,"Rainer, Helmut; Siedler, Thomas",,,The role of social networks in determining migration and labour market outcomes,ECONOMICS OF TRANSITION,,,,,,,,,,,,"This paper empirically examines social network explanations for migration decisions in the context of German reunification. Using longitudinal data from the German Socio-Economic Panel, we first show that the presence of a family in West Germany is an important predictor for the migration hazard rate of East Germans. We then explore whether pre-migration networks have a discernible impact on the economic and social assimilation of East German immigrants in West Germany. We find that East German immigrants are more likely to be employed and to hold higher paying jobs when socially connected to the West prior to emigrating.",,,,,"Rainer, Helmut/0000-0003-1181-2568",,,,,,,,,,,,0967-0750,1468-0351,,,,,2009,17,4,,,,,739,767,,10.1111/j.1468-0351.2009.00365.x,,,,,,,WOS:000269674800005,,,,,
B,"McCann, P",,"Karlsson, C",,"McCann, Philip",,,Agglomeration economics,HANDBOOK OF RESEARCH ON CLUSTER THEORY,,,,,,,,,,,,,,,,"McCann, Philip/C-6307-2013","McCann, Philip/0000-0003-0389-0654",,,,,,,,,,,,,,978-1-84542-516-6,,,,2008,,,,,,,23,38,,,,,,,,,WOS:000303801900003,,,,,
J,"Tassier, T",,,,"Tassier, T",,,Labor market implications of weak ties,SOUTHERN ECONOMIC JOURNAL,,,,,,,,,,,,"Although many workers find employment through weak ties, previous studies have shown little empirical support for a connection between weak ties and income. In this article, I explain one reason why the survey methods used in previous studies underestimate, perhaps greatly, the effect of weak ties on income. In addition, I demonstrate a more direct method of estimating the effect of weak ties on income by using information from the General Social Survey on the overlap of close friends of respondents. I find that the range of social connections provided by weak ties has a significant and economically meaningful effect on income.",,,,,,,,,,,,,,,,,0038-4038,,,,,JAN,2006,72,3,,,,,704,719,,10.2307/20111842,,,,,,,WOS:000235351200012,,,,,
J,"Annen, K",,,,"Annen, K",,,Inclusive and exclusive social capital in the small-firm sector in developing countries,JOURNAL OF INSTITUTIONAL AND THEORETICAL ECONOMICS-ZEITSCHRIFT FUR DIE GESAMTE STAATSWISSENSCHAFT,,,,,,,,,,,,This article explores the role of social capital created by social network membership in the small-firm sector in developing countries. Some empirical studies find that social capital hampers economic performance by creating market segmentation and inducing rent-seeking activities. Other studies conclude that social capital is an important prerequisite for productive interaction among small firms. This paper develops a concept of social capital governance which distinguishes between inclusive and exclusive social capital. It argues that inclusive social capital furthers economic performance while exclusive social capital may not. Two case studies are included.,,,,,,,,,,,,,,,,,0932-4569,,,,,JUN,2001,157,2,,,,,319,330,,10.1628/0932456013623150,,,,,,,WOS:000170224500006,,,,,
J,"Lin, T; Wang, DG",,,,"Lin, Tao; Wang, Donggen",,,Social networks and joint/solo activity-travel behavior,TRANSPORTATION RESEARCH PART A-POLICY AND PRACTICE,,,,,,,,,,,,"The social dimension of activity-travel behavior has recently received much research attention. This paper aims to make a contribution to this growing literature by investigating individuals' engagements in joint activities and activity companion choices. Using activity-travel diary data collected in Hong Kong in 2010, this study examines the impact of social network attributes on the decisions between solo and joint activities, and for joint activities, the choices of companions. Chi-square difference tests are used to assess the importance of social network variables in explaining joint activity behavior. We find that the inclusion of social network attributes significantly improves the goodness-of-fit of the model with only socioeconomic variables. Specifically, individuals receiving emotional support and social companionship from family members/relatives are found to more likely undertake joint activities with their family members/relatives; the size of personal social networks is found to be a significant determinant of companion choices for joint activities; and activity companions are found to be significant determinants of travel companions. The findings of this study improve the understanding about activity-travel, especially joint activity-travel decisions. (C) 2014 Elsevier Ltd. All rights reserved.",,,,,"Wang, Donggen/0000-0003-4249-761X",,,,,,,,,,,,0965-8564,,,,,OCT,2014,68,,,,SI,,18,31,,10.1016/j.tra.2014.04.011,,,,,,,WOS:000344422200003,,,,,
J,"Backes-Gellner, U; Moog, P",,,,"Backes-Gellner, Uschi; Moog, Petra",,,The disposition to become an entrepreneur and the jacks-of-all-trades in social and human capital,JOURNAL OF SOCIO-ECONOMICS,,,,,,,,,,,,"This paper studies how an individual's composition of human and social capital affects his or her disposition to become an entrepreneur. Our theoretical analysis is an extension of Lazear's (2005) jack-of-all-trades theory in combination with the idea of bricolage of experiences and their effectuation in the disposition to become an entrepreneur. Our primary conclusion is that it is not individuals with a higher level of human or social capital but rather individuals with a more balanced and combined portfolio of human capital, social capital and experiences that are more disposed than others to become entrepreneurs. We use survey data from a sample of more than 2000 German students to test this hypothesis and find that the jacks-of-all-trades, i.e., individuals who are more balancing and combining different skills rather than specializing in a few, are more likely to become entrepreneurs. On the other hand, the masters-of-one, i.e., the specialists, are better off being employees and rightly prefer to do so. (C) 2013 Elsevier Inc. All rights reserved.",,,,,,,,,,,,,,,,,1053-5357,,,,,DEC,2013,47,,,,,,55,72,,10.1016/j.socec.2013.08.008,,,,,,,WOS:000333061800007,,,,,
J,"Kesidou, E; Snijders, C",,,,"Kesidou, Effie; Snijders, Chris",,,External Knowledge and Innovation Performance in Clusters: Empirical Evidence from the Uruguay Software Cluster,INDUSTRY AND INNOVATION,,,,,,,,,,,,"The importance of geographic proximity for innovation has been widely stressed in the cluster literature. Yet, new insights from the inter-organisational network and cluster literatures underline the role of non-local linkages in enabling firms in networks to enhance learning and to innovate. This paper contributes to this literature by examining the importance of local and non-local knowledge networks for the innovation performance of firms in clusters. Our analysis is based on primary data from a survey of 95 software firms clustered in Montevideo, Uruguay. The results highlight that the most innovative firms in clusters heavily rely on non-local knowledge networks. Moreover, the number of indirect local ties to other firms is a better predictor of innovative performance than the number of direct local ties. Finally, our findings confirm the presence of knowledge gatekeepers in clusters and emphasise their role in enhancing innovation in clusters by absorbing knowledge from extra-cluster sources and diffusing it to other local firms.",,,,,"Kesidou, Effie/0000-0002-5729-8624",,,,,,,,,,,,1366-2716,,,,,,2012,19,5,,,,,437,457,,10.1080/13662716.2012.711028,,,,,,,WOS:000307929600004,,,,,
B,"Levy, J",,,,"Levy, J",,,"Making of a Market: Credit, Henequen, and Notaries in Yucatan, 1850-1900","MAKING OF A MARKET: CREDIT, HENEQUEN, AND NOTARIES IN YUCATAN, 1850-1900",,,,,,,,,,,,,,,,,,,,,,,,,,,,,,,978-0-271-05213-7; 978-0-271-05214-4,,,,2012,,,,,,,1,164,,,,,,,,,WOS:000326723100009,,,,,
J,"Vorley, T; Mould, O; Courtney, R",,,,"Vorley, Tim; Mould, Oli; Courtney, Richard",,,My Networking Is Not Working! Conceptualizing the Latent and Dysfunctional Dimensions of the Network Paradigm,ECONOMIC GEOGRAPHY,,,,,,,,,,,,"Networks have become a major analytical concept in economic geography and have served to extend both empirical and theoretical research agendas. However, much of the literature on networks is characterized as associative, considering them only as cumulative constructs through the constant enrollment of additional actors. Through the lens of social capital and a discussion of the limitations of the networking paradigm in economic geography, this article aims to move beyond this associative nature and introduce variance in network practices in the form of nonworking and not working. By presenting a hypothetical example of a project-based network, we introduce the concepts of nonworking and not working as latency and disassociation as dimensions of network practices. In doing so, we present a more nuanced approach to the networking paradigm in relational economic geography, one that moves beyond a purely associative understanding to incorporate nonworking and not working.",,,,,,,,,,,,,,,,,0013-0095,,,,,JAN,2012,88,1,,,,,77,96,,10.1111/j.1944-8287.2011.01141.x,,,,,,,WOS:000298875900006,,,,,
B,"Kleinberg, J; Suri, S; Tardos, E; Wexler, T",,,ACM,"Kleinberg, Jon; Suri, Siddharth; Tardos, Eva; Wexler, Tom",,,Strategic Network Formation with Structural Holes,EC'08: PROCEEDINGS OF THE 2008 ACM CONFERENCE ON ELECTRONIC COMMERCE,,,,,ACM Conference on Electronic Commerce,"JUL 08-12, 2008","Chicago, IL","ACM SIGecom, Microsoft Res, Google, Yahoo Res, HP Labs, CombineNet, NW Univ",,,,"A fundamental principle in social network research is that individuals can benefit from serving as intermediaries between others who are not directly connected. Through such intermediation, they potentially can broker the flow of information and synthesize ideas arising in different parts of the network. These principles form the underpinning for the theory of structural holes, which studies the ways in which individuals, particularly in organizational settings, fill the ""holes"" between people or groups that are not otherwise interacting. We apply a game-theoretic approach to this notion, studying the structures that evolve when individuals in a social network have incentives to form links that bridge other-wise disconnected parties. We model payoffs as a trade-off between the benefits of connecting non-neighboring nodes, and the cost, in effort, to maintain links including settings where the costs are non-uniform to reflect the increased difficulty in spanning different parts of a hierarchical organization. We find, both through theoretical results and computational experiments, that the equilibrium networks in this model have rich combinatorial structure, and capture qualitative observations arising in the study of structural holes. In particular, even in completely symmetric settings, individuals will differentiate themselves in equilibrium, occupying different social strata and receiving correspondingly different payoffs.",,,,,,,,,,,,,,,,,,,978-1-60558-169-9,,,,2008,,,,,,,284,293,,,,,,,,,WOS:000268027400035,,,,,
J,"Finneran, L; Kelly, M",,,,"Finneran, L; Kelly, M",,,Social networks and inequality,JOURNAL OF URBAN ECONOMICS,,,,,,,,,,,,"About half of all vacancies are filled through networks of personal contact. We consider the Arrow-Loury conjecture that such labor market networks exacerbate inequality. Our central result is that referral networks display threshold behavior. Above a critical density of referrals, qualified workers at all levels of the network are recruited with probability one. Below the threshold, the probability of referral falls exponentially and workers low in the hierarchy are hired with probability zero: an underclass emerges. (C) 2003 Elsevier Science (USA). All rights reserved.",,,,,,,,,,,,,,,,,0094-1190,,,,,MAR,2003,53,2,,,,,282,299,,10.1016/S0094-1190(02)00513-2,,,,,,,WOS:000182488800005,,,,,
J,"Dershem, L; Gzirishvili, D",,,,"Dershem, L; Gzirishvili, D",,,Informal social support networks and household vulnerability: Empirical findings from Georgia,WORLD DEVELOPMENT,,,,,,,,,,,,"This paper examines the effect of informal social networks on the self-perceived food, economic and housing vulnerability of households in Georgia. Findings from the most recent nationally representative sample, conducted in March 1996, show that when controlling for selected respondent and household characteristics, informal social networks significantly decrease the likelihood of a household evaluating its food, economic and housing condition as vulnerable. (C) 1998 Elsevier Science Ltd. All rights reserved.",,,,,,,,,,,,,,,,,0305-750X,,,,,OCT,1998,26,10,,,,,1827,1838,,10.1016/S0305-750X(98)00085-0,,,,,,,WOS:000077567500004,,,,,
J,"Pettifor, H; Wilson, C; Axsen, J; Abrahamse, W; Anable, J",,,,"Pettifor, H.; Wilson, C.; Axsen, J.; Abrahamse, W.; Anable, J.",,,Social influence in the global diffusion of alternative fuel vehicles - A meta-analysis,JOURNAL OF TRANSPORT GEOGRAPHY,,,,,,,,,,,,"Alternative fuel vehicle technologies are needed to mitigate rising greenhouse gas emissions from transport. Social influence is integral to the diffusion of private vehicles which are highly visible and fulfil practical as well as social functions. This paper provides the first meta-analysis of empirical studies which measure the strength of social influence on consumer vehicle choice. A systematic literature review identified 21 studies that examined three types of social influence: interpersonal communication; neighbourhood effect; and conformity with social norms. A random effects meta-analysis found a significant and small to moderate effect of social influence on vehicle choices (r = 0.241, p < 0.001). The overall effect size did not vary significantly between types of social influence nor between types of vehicle (conventional or alternative fuel). However, further analysis using meta regression found that heterogeneity in social influence effect size across studies was explained by differences in countries' cultural receptiveness to normative influence. These findings have important implications for policy and modelling analysis of alternative fuel vehicle adoption, for which diffusion is both a socially and culturally mediated process.",,,,,"Wilson, Charlie/0000-0001-8164-3566",,,,,,,,,,,,0966-6923,1873-1236,,,,JUN,2017,62,,,,,,247,261,,10.1016/j.jtrangeo.2017.06.009,,,,,,,WOS:000412037500022,,,,,
J,"Liang, PH; Guo, SQ",,,,"Liang, Pinghan; Guo, Shiqi",,,"Social interaction, Internet access and stock market participation-An empirical study in China",JOURNAL OF COMPARATIVE ECONOMICS,,,,,,,,,,,,"Social interaction plays an important role in transmitting relevant information to potential investors. However, the informational role of social interaction might be affected by other information channels, which is to a large extent ignored in previous studies. Using a national representative household finance survey data covering more than 8000 Chinese households, we demonstrate that social interaction alone positively affects household stock market participation, but Internet access mitigates the influence of social interaction. In particular, among households with the access to Internet, sociable households in effect are associated with a 6 percentage-point decrease in the probability to participate in the stock market. This finding supports the substitution between Internet access and social interaction as information channels. Moreover, we also identify the social multiplier effect of social interaction: sociable households living in the communities with higher stock market participation rate are more likely to invest in stocks. Journal of Comparative Economics 43 (4) (2015) 883-901. Research Institute of Economics and Management, Southwestern University of Finance and Economics, China. (C) 2015 Association for Comparative Economic Studies. Published by Elsevier B.V. All rights reserved.",,,,"Guo, Shiqi/J-5396-2019","Liang, Pinghan/0000-0003-4741-3083",,,,,,,,,,,,0147-5967,1095-7227,,,,NOV,2015,43,4,,,,,883,901,,10.1016/j.jce.2015.02.003,,,,,,,WOS:000368305900004,,,,,
J,"Wang, C; Steiner, B",,,,"Wang, Cong; Steiner, Bodo",,,Can Ethno-Linguistic Diversity Explain Cross-Country Differences in Social Capital?: A Global Perspective,ECONOMIC RECORD,,,,,,,,,,,,"Motivated by the inconclusiveness of empirical studies on the relationship between ethno-linguistic diversity and social capital (SC) at various levels of regional aggregation, this paper provides new evidence on the relationship between the two variables at a global scale. A cross-sectional analysis of 68 developed and developing countries applying two-stage least squares estimations suggests not only that the cognitive dimension of SC (shared codes and languages) is highly important for SC formation across regional origin, but also that countries with a greater degree of linguistic fractionalisation have a lower SC stock. In particular, countries with fractionalized ethnic and linguistic groups, as captured by number of languages and measures of linguistic diversity, tend to have lower levels of social trust, fewer memberships in social organisations, and deteriorated social norms and structures. The negative ethnic fractionalisation effect on SC is also found weaker in higher-income and in non-African countries.",,,,,"Steiner, Bodo/0000-0002-5357-8856; , Cong/0000-0002-6852-5490",,,,,,,,,,,,0013-0249,1475-4932,,,,SEP,2015,91,294,,,,,338,366,,10.1111/1475-4932.12195,,,,,,,WOS:000361037400005,,,,,
J,"Belussi, F",,,,"Belussi, Fiorenza",,,The international resilience of Italian industrial districts/clusters (ID/C) between knowledge-reshoring and manufacturing off (near)-shoring,INVESTIGACIONES REGIONALES,,,,,,,,,,,,"The literature regarding ID/C is based on seminal writings of Marshall, followed by Giacomo Becattini's rediscovering of the concept of an ""industrial district"". But the concept of a ""cluster"" was also promoted during the 1980s by Porter, and highlighted the importance of geographically clustered and interconnected firms and institutions specialised in a particular field. Despite the model of ID/C has been often described as locally self-contained, various empirical researches and our analysis have pointed out its increasing involvement in the process of internationalization. The recent entry and exit of MNEs, and the phenomena of off-shoring did not question the model of ID/C per se, but it contributed to showing how interwoven the evolution of local economies and MNEs is.",,,,,,,,,,,,,,,,,1695-7253,2340-2717,,,,,2015,,32,,,SI,,89,113,,,,,,,,,WOS:000217223400007,,,,,
J,"Dufhues, T; Buchenrieder, G; Quoc, HD; Munkung, N",,,,"Dufhues, Thomas; Buchenrieder, Gertrud; Hoang Dinh Quoc; Munkung, Nuchanata",,,Social capital and loan repayment performance in Southeast Asia,JOURNAL OF SOCIO-ECONOMICS,,,,,,,,,,,,"This paper analyses the effects of different forms of social capital on credit repayment behaviour. In the context of development economics an innovative data collection approach is used that originates from the field of sociology. A personal network survey is carried out to measure the individual social capital of borrowers. We distinguish four social capital variables between the respondent and his/her network members according to tie strength (bonding/bridging) and social distance (bonding(link)/bridging(link)). The effects of social capital vary according to socio-cultural context. For instance, in Thailand bonding and in Vietnam bridging(link) social capital has a positive effect on loan repayment. (C) 2011 Elsevier Inc. All rights reserved.",,,,"Buchenrieder, Gertrud/S-1035-2016","Buchenrieder, Gertrud/0000-0003-2995-867X",,,,,,,,,,,,1053-5357,,,,,OCT,2011,40,5,,,,,679,691,,10.1016/j.socec.2011.05.007,,,,,,,WOS:000208882700028,,,,,
J,"Dodgson, M",,,,"Dodgson, Mark",,,"Exploring new combinations in innovation and entrepreneurship: social networks, Schumpeter, and the case of Josiah Wedgwood (1730-1795)",INDUSTRIAL AND CORPORATE CHANGE,,,,,,,,,,,,"Innovation and entrepreneurship are based on new combinations, constructed within social networks. The literature on social networks refers to Schumpeter's analysis of new combinations, but is limited in its use of his understanding of the range of innovations and long-term aspects of entrepreneurship. Using the case of Josiah Wedgwood, a quintessential Schumpeterian entrepreneur, this article analyses how social networks contribute to a broad range of innovations over an extended period, involving both strong and weak ties. It shows how social network research in innovation and entrepreneurship benefits from Schumpeterian insights on the wide forms of innovation and longer term influences on network structures.",,,,"Dodgson, Mark J/A-5953-2008","Dodgson, Mark J/0000-0001-8532-946X",,,,,,,,,,,,0960-6491,,,,,AUG,2011,20,4,,,,,1119,1151,,10.1093/icc/dtr021,,,,,,,WOS:000293074800006,,,,,
J,"Bhattacharjee, A; Holly, S",,,,"Bhattacharjee, Arnab; Holly, Sean",,,Structural interactions in spatial panels,EMPIRICAL ECONOMICS,,,,,,,,,,,,"Until recently, considerable effort has been devoted to the estimation of panel data regression models without adequate attention being paid to the drivers of interaction amongst cross-section and spatial units. We discuss some new methodologies in this emerging area and demonstrate their use in measurement and inferences on cross-section and spatial interactions. Specifically, we highlight the important distinction between spatial dependence driven by unobserved common factors and those based on a spatial weights matrix. We argue that purely factor-driven models of spatial dependence may be inadequate because of their connection with the exchangeability assumption. The three methods considered are appropriate for different asymptotic settings; estimation under structural constraints when N is fixed and T -> a, whilst the methods based on GMM and common correlated effects are appropriate when T a parts per thousand << N -> a. Limitations and potential enhancements of the existing methods are discussed, and several directions for new research are highlighted.",,,,,"Bhattacharjee, Arnab/0000-0003-1300-0838",,,,,,,,,,,,0377-7332,1435-8921,,,,FEB,2011,40,1,,,,,69,94,,10.1007/s00181-010-0396-1,,,,,,,WOS:000286989100004,,,,,
