PT,AU,BA,BE,GP,AF,BF,CA,TI,SO,SE,BS,LA,DT,CT,CY,CL,SP,HO,DE,ID,AB,C1,RP,EM,RI,OI,FU,FX,CR,NR,TC,Z9,U1,U2,PU,PI,PA,SN,EI,BN,J9,JI,PD,PY,VL,IS,PN,SU,SI,MA,BP,EP,AR,DI,D2,EA,PG,WC,SC,GA,UT,PM,OA,HC,HP,DA
J,"Woolcock, M; Narayan, D",,,,"Woolcock, M; Narayan, D",,,"Social capital: Implications for development theory, research, and policy",WORLD BANK RESEARCH OBSERVER,,,,,,,,,,,,"In the 1990s the concept of social capital-defined here as the norms and networks that enable people to act collectively-enjoyed a remarkable rise to prominence across all the social science disciplines. The authors trace the evolution of social capital research as it pertains to economic development and identify four distinct approaches the research has taken: communitarian, networks, institutional and synergy. The evidence suggests that of the four, the synergy view, with its emphasis on incorporating different levels and dimensions of social capital and its recognition of the positive and negative outcomes that social capital can generate, has the greatest empirical support and lends itself best to comprehensive and coherent policy prescriptions. The authors argue that a significant virtue of the idea of and discourse on social capital is that it helps to bridge orthodox divides among scholars, practitioners, and policymakers.",,,,,,,,,,,,,,,,,0257-3032,,,,,AUG,2000,15,2,,,,,225,249,,10.1093/wbro/15.2.225,,,,,,,WOS:000165829000005,,,,,
B,"Jackson, MO",,,,"Jackson, MO",,,Social and Economic Networks,SOCIAL AND ECONOMIC NETWORKS,,,,,,,,,,,,,,,,,,,,,,,,,,,,,,,978-0-691-13440-6,,,,2008,,,,,,,1,504,,,,,,,,,WOS:000288018200016,,,,,
J,"Unruh, GC",,,,"Unruh, GC",,,Understanding carbon lock-in,ENERGY POLICY,,,,,,,,,,,,"This paper narrative argues that industrial economies have been locked into fossil fuel-based energy systems through a process of technological and institutional co-evolution driven by path-dependent increasing returns to scale. It is asserted that this condition, termed carbon lock-in, creates persistent market and policy failures that can inhibit the diffusion of carbon-saving technologies despite their apparent environmental and economic advantages. The notion of a Techno-Institutional Complex is introduced to capture the idea that lock-in occurs through combined interactions among technological systems and governing institutions. While carbon lock-in provides a conceptual basis for understanding macro-level barriers to the diffusion of carbon-saving technologies, it also generates questions for standard economic modeling approaches that abstract away technological and institutional evolution in their elaboration. The question of escaping carbon lock-in is left for a future paper. (C) 2000 Elsevier Science Ltd. All rights reserved.",,,,,,,,,,,,,,,,,0301-4215,,,,,OCT,2000,28,12,,,,,817,830,,10.1016/S0301-4215(00)00070-7,,,,,,,WOS:000088686700001,,,,,
J,"Martin, R; Sunley, P",,,,"Martin, Ron; Sunley, Peter",,,Path dependence and regional economic evolution,JOURNAL OF ECONOMIC GEOGRAPHY,,,,,,,,,,,,"In recent years, economic geographers have seized on the concepts of 'path dependence' and 'lock-in' as key ingredients in constructing an evolutionary approach to their subject. However, they have tended to invoke these notions without proper examination of the ongoing discussion and debate devoted to them within evolutionary economics and elsewhere. Our aim in this paper, therefore, is, first, to highlight some of the unresolved issues that surround these concepts, and, second, to explore their usefulness for understanding the evolution of the economic landscape and the process of regional development. We argue that in many important aspects, path dependence and 'lock-in' are place-dependent processes, and as such require geographical explanation. However, the precise meaning of regional 'lock-in', we contend, is unclear, and little is known about why it is that some regional economies become locked into development paths that lose dynamism, whilst other regional economies seem able to avoid this danger and in effect are able to 'reinvent' themselves through successive new paths or phases of development. The issue of regional path creation is thus equally important, but has been rarely discussed. We conclude that whilst path dependence is an important feature of the economic landscape, the concept requires further elaboration if it is to function as a core notion in an evolutionary economic geography.",,,,,,,,,,,,,,,,,1468-2702,1468-2710,,,,AUG,2006,6,4,,,,,395,437,,10.1093/jeg/lbl012,,,,,,,WOS:000239839400001,,,,,
J,"Torre, A; Rallett, A",,,,"Torre, A; Rallett, A",,,Proximity and localization,REGIONAL STUDIES,,,,,,,,,,,,"The objective of this paper is to pave the way for an analysis of the relations between proximity and localization of activities and people, two notions that are often mistaken for one another. Our method consists in exploiting the semantic wealth of the notion of proximity. We distinguish two types of proximity (geographical and organized) and propose a grid of analysis of the main models of geographic organization of activities by articulating both types of proximity. We then introduce the phenomenon of tension between geographical and organized proximity in order to discuss problems that are often underestimated in spatial economy. First, organized proximity offers powerful mechanisms of long-distance coordination that constitute the foundation of the increasing geographical development of socio-economic interactions. The confusion between information interactions and knowledge exchange, and the constraint of being located in proximity neglects the fact that the collective rules and representations do manage, and at a distance, an increasing part of these interactions. It is then shown that there is a disjunction between the need for geographical proximity and co-localization of actors by introducing professional mobility and temporary geographical proximity. We also emphasize the ability of big organizations to manage the presence in different areas of their units, whereas smaller ones are more constrained by fixed co-localizations, which are only needed for certain phases of their interactions. Finally, we raise the often neglected question of the negative effects of geographical proximity which creates tensions between the actors who use limited support-goods and tends to damage the local relational network. However, these negative effects can be limited by integrating them within organizations or institutions, that is through a re-composed organized proximity enabling one to solve conflicts and launch processes of cooperation or negotiation within ad-hoc mechanisms.",,,,"Torre, Andre/U-1081-2018","Torre, Andre/0000-0001-5644-7520",,,,,,,,,,,,0034-3404,1360-0591,,,,FEB,2005,39,1,,,,,47,59,,10.1080/0034340052000320842,,,,,,,WOS:000226292500004,,,,,
J,"Cowan, R; Jonard, N",,,,"Cowan, R; Jonard, N",,,Network structure and the diffusion of knowledge,JOURNAL OF ECONOMIC DYNAMICS & CONTROL,,,,,,,,,,,,"This paper models knowledge diffusion as a barter process in which agents exchange different types of knowledge. This is intended to capture the observed practice of informal knowledge trading. Agents are located on a network and are directly connected with a small number of other agents. Agents repeatedly meet those with whom direct connections exist and trade if mutually profitable trades exist. In this way knowledge diffuses throughout the economy. We examine the relationship between network architecture and diffusion performance. We consider the space of structures that fall between, at one extreme, a network in which every agent is connected to n nearest neighbours, and at the other extreme a network with each agent being connected to, on average, n randomly chosen agents. We find that the performance of the system exhibits clear 'small world' properties, in that the steady-state level of average knowledge is maximal when the structure is a small world (that is, when most connections are local, but roughly 10 percent of them are long distance). The variance of knowledge levels among agents is maximal in the small world region, whereas the coefficient of variation is minimal. We explain these results as reflecting the dynamics of knowledge transmission as affected by the architecture of connections among agents. (C) 2003 Elsevier B.V. All rights reserved.",,,,"Wang, Charles/B-5565-2011","Wang, Charles/0000-0001-9331-8437",,,,,,,,,,,,0165-1889,,,,,JUN,2004,28,8,,,,,1557,1575,,10.1016/j.jedc.2003.04.002,,,,,,,WOS:000220265000005,,,,,
J,"Rauch, JE",,,,"Rauch, JE",,,Business and social networks in international trade,JOURNAL OF ECONOMIC LITERATURE,,,,,,,,,,,,,,,,,,,,,,,,,,,,,0022-0515,,,,,DEC,2001,39,4,,,,,1177,1203,,10.1257/jel.39.4.1177,,,,,,,WOS:000172746600004,,,,,
J,"Caliskan, K; Callon, M",,,,"Caliskan, Koray; Callon, Michel",,,"Economization, part 2: a research programme for the study of markets",ECONOMY AND SOCIETY,,,,,,,,,,,,"Presented in two parts, this article proposes a research programme devoted to examining 'processes of economization'. In the first instalment, published in Economy and Society 38(3) (2009), we introduced the notion of 'economization'. The term refers to the assembly and qualification of actions, devices and analytical/practical descriptions as 'economic' by social scientists and market actors. Through an analysis of selected works in anthropology, economics and sociology, we discussed the importance, meaning and framing of economization, unravelling its trace within a variety of disciplinary backgrounds. This second instalment of the article explores what it would mean to move this research programme forward by taking processes of economization as a topic of empirical investigation. Given the vast terrain of relationships that produce its numerous trajectories, to illustrate what such a project would entail we have limited ourselves to the examination of processes we call 'marketization'. These processes, which constitute but one modality of economization, are discussed here from five vantage points: the things in the market, agencies, encounters, prices and market maintenance.",,,,,,,,,,,,,,,,,0308-5147,1469-5766,,,,FEB,2010,39,1,,,,,1,32,,10.1080/03085140903424519,,,,,,,WOS:000275815500001,,,,,
J,"Elfring, T; Hulsink, W",,,,"Elfring, T; Hulsink, W",,,Networks in entrepreneurship: The case of high-technology firms,SMALL BUSINESS ECONOMICS,,,,,,,,,,,,"The value of networks as an integral part of the explanation of entrepreneurial success is widely acknowledged. However, the network perspective does not specify the role of networks in the emergence and early growth of a venture. We have distinguished three entrepreneurial processes in new venture development, i.e. discovery of opportunities, securing resources, and obtaining legitimacy, which are of importance for survival and performance. This paper examines how these processes are influenced by strong and/or weak ties and whether the degree of innovation (incremental versus radical) acts as a contingency factor in the way network ties support entrepreneurial processes. In this explorative study three cases on high technology firms in The Netherlands provide empirical material enabling us to develop a number of propositions on the network effect, in particular the mix of strong and weak ties, on the three entrepreneurial processes.",,,,,,,,,,,,,,,,,0921-898X,,,,,DEC,2003,21,4,,,,,409,422,,10.1023/A:1026180418357,,,,,,,WOS:000185859100008,,,,,
J,"Morris, S",,,,"Morris, S",,,Contagion,REVIEW OF ECONOMIC STUDIES,,,,,,,,,,,,"Each player in an infinite population interacts strategically with a finite subset of that population. Suppose each player's binary choice in each period is a best response to the population choices of the previous period. When can behaviour that is initially played by only a finite set of players spread to the whole population? This paper characterizes when such contagion is possible for arbitrary local interaction systems. Maximal contagion occurs when local interaction is sufficiently uniform and there is low neighbour growth, i.e. the number of players who can be reached in k steps does not grow exponentially in k.",,,,,,,,,,,,,,,,,0034-6527,,,,,JAN,2000,67,1,,,,,57,78,,10.1111/1467-937X.00121,,,,,,,WOS:000085640300004,,,,,
J,"Menzel, MP; Fornahl, D",,,,"Menzel, Max-Peter; Fornahl, Dirk",,,Cluster life cycles-dimensions and rationales of cluster evolution,INDUSTRIAL AND CORPORATE CHANGE,,,,,,,,,,,,"We present a model that explains how the very cluster dynamics is both the driver for the movement of a cluster through a life cycle and the reason why this movement differs from the industry life cycle. The model is based on two key processes: the first is that the emergence, growth, decline and renewal of the cluster depend on the technological heterogeneity of firms; the second is that firms have a larger relative absorptive capacity, when they are in the same location, and thus especially localized learning changes heterogeneity: it leads to a technological convergence when learning takes place within the cluster and technological divergence, when learning takes place outside the cluster, yet in the same region. We derive hypothesis from the model regarding different phases of the cluster life cycle.",,,,,"Fornahl, Dirk/0000-0001-7585-4367; Menzel, Max-Peter/0000-0003-0298-1159",,,,,,,,,,,,0960-6491,,,,,FEB,2010,19,1,,,,,205,238,,10.1093/icc/dtp036,,,,,,,WOS:000274088700007,,,,,
J,"Agrawal, A; Cockburn, I; McHale, J",,,,"Agrawal, Ajay; Cockburn, Iain; McHale, John",,,"Gone but not forgotten: knowledge flows, labor mobility, and enduring social relationships",JOURNAL OF ECONOMIC GEOGRAPHY,,,,,,,,,,,,"We examine the role of social relationships in facilitating knowledge flows by estimating the flow premium captured by a mobile inventor's previous location. Once an inventor has moved, they are gone-but are they forgotten? We find that knowledge flows to an inventor's prior location are approximately 50% greater than if they had never lived there, suggesting that social relationships, not just physical proximity, are important for determining flow patterns. Furthermore, we find that a large portion of this social effect is mediated by institutional links; however, this is not the result of corporate knowledge management systems but rather of personal relationships formed through co-location within an institutional context that endure over time, space, and organizational boundaries. Moreover, we find the effect is nearly twice as large for knowledge flows across as compared to within fields, suggesting that co-location may substitute for communities of practice in determining flow patterns.",,,,"Cockburn, Iain/G-9524-2013; Wang, Charles/B-5565-2011","Cockburn, Iain/0000-0003-2034-0187; Wang, Charles/0000-0001-9331-8437",,,,,,,,,,,,1468-2702,1468-2710,,,,NOV,2006,6,5,,,,,571,591,,10.1093/jeg/lbl016,,,,,,,WOS:000244389500002,,,,,
J,"Fox, J",,,,"Fox, J",,,How does civil society thicken? The political construction of social capital in rural Mexico,WORLD DEVELOPMENT,,,,,"Conference on Government Action, Social Capital Formation, and 3rd-World Development","MAY 05-06, 1995","CAMBRIDGE, MA","Econ Dev Working Grp, Social Capital & Public Affairs Project",,,,"The growth of the building-block organizations of an autonomous civil society in an authoritarian environment depends on the ''political construction'' of social capital. Social capital can be coproduced by state and local societal actors or by the interaction of local societal actors and external actors in civil society. Social capital may also be produced from below, but external allies still turn out to be crucial in the ability of such organizations to survive. An examination of variety in political dynamics across different regions and over time in rural Mexico provides ample illustration of these general points. Copyright (C) 1996 Elsevier Science Ltd",,,,,,,,,,,,,,,,,0305-750X,,,,,JUN,1996,24,6,,,,,1089,1103,,10.1016/0305-750X(96)00025-3,,,,,,,WOS:A1996UW25900010,,,,,
J,"Ter Wal, ALJ; Boschma, RA",,,,"Ter Wal, Anne L. J.; Boschma, Ron A.",,,Applying social network analysis in economic geography: framing some key analytic issues,ANNALS OF REGIONAL SCIENCE,,,,,,,,,,,,"Social network analysis attracts increasing attention in economic geography. We claim social network analysis is a promising tool for empirically investigating the structure and evolution of inter-organizational interaction and knowledge flows within and across regions. However, the potential of the application of network methodology to regional issues is far from exhausted. The aim of our paper is twofold. The first objective is to shed light on the untapped potential of social network analysis techniques in economic geography: we set out some theoretical challenges concerning the static and dynamic analysis of networks in geography. Basically, we claim that network analysis has a huge potential to enrich the literature on clusters, regional innovation systems and knowledge spillovers. The second objective is to describe how these challenges can be met through the application of network analysis techniques, using primary (survey) and secondary (patent) data. We argue that the choice between these two types of data has strong implications for the type of research questions that can be dealt with in economic geography, such as the feasibility of dynamic network analysis.",,,,"Ter Wal, Anne/B-4940-2008","Ter Wal, Anne/0000-0002-6041-6898",,,,,,,,,,,,0570-1864,,,,,SEP,2009,43,3,,,,,739,756,,10.1007/s00168-008-0258-3,,,,,,,WOS:000268281400009,,,,,
J,"Ruef, M",,,,"Ruef, M",,,"Strong ties, weak ties and islands: structural and cultural predictors of organizational innovation",INDUSTRIAL AND CORPORATE CHANGE,,,,,,,,,,,,"How does the tendency of entrepreneurs to engage in innovation relate to their structural and cultural embeddedness? Using micro-data on entrepreneurial teams and the organizational innovations they attempt to develop, this article presents a predictive model of creative action to address this question. Capacity for creative action is seen to be a function of the ability of entrepreneurs to (i) obtain non-redundant information from their social networks; (ii) avoid pressures for conformity; and (iii) sustain trust in developing novel-and potentially profitable-innovations. Probit analyses of over 700 organizational startups suggest that these mechanisms exercise effects on innovation via the network ties and enculturation of entrepreneurs.",,,,"Hoek, Carien/K-9106-2013",,,,,,,,,,,,,0960-6491,1464-3650,,,,JUN,2002,11,3,,,,,427,449,,10.1093/icc/11.3.427,,,,,,,WOS:000176482000002,,,,,
J,"Morrison, A",,,,"Morrison, Andrea",,,"Gatekeepers of knowledge within industrial districts: Who they are, how they interact",REGIONAL STUDIES,,,,,,,,,,,,"Studies on industrial districts suggest that their innovative performance is strictly linked to their ability to absorb external knowledge. Yet, the existing literature provides few insights into the functioning of this process. This paper, focusing on leader firms located in a successful Italian furniture district, investigates whether they feed the district with knowledge absorbed from external sources, thereby behaving as 'gatekeepers of knowledge'. Findings show that leader firms are well connected with knowledge sources; yet, linkages with districts firms are far more limited as are informal exchanges that, when they do occur, are mostly restricted to generic information.",,,,,"Morrison, Andrea/0000-0002-1878-6780",,,,,,,,,,,,0034-3404,,,,,,2008,42,6,,,,,817,835,,10.1080/00343400701654178,,,,,,,WOS:000257336500004,,,,,
J,"Hoberg, G; Phillips, G",,,,"Hoberg, Gerard; Phillips, Gordon",,,Product Market Synergies and Competition in Mergers and Acquisitions: A Text-Based Analysis,REVIEW OF FINANCIAL STUDIES,,,,,,,,,,,,"We use text-based analysis of 10-K product descriptions to examine whether firms exploit product market synergies through asset complementarities in mergers and acquisitions. Transactions are more likely between firms that use similar product market language. Transaction stock returns, ex post cash flows, and growth in product descriptions all increase for transactions with similar product market language, especially in competitive product markets. These gains are larger when targets are less similar to acquirer rivals and when targets have unique products. Our findings are consistent with firms merging and buying assets to exploit synergies to create new products that increase product differentiation.",,,,"Phillips, Gordon/E-4636-2011; Hoberg, Gerard/F-9117-2010","Hoberg, Gerard/0000-0001-5104-9689",,,,,,,,,,,,0893-9454,,,,,OCT,2010,23,10,,,,,3773,3811,,10.1093/rfs/hhq053,,,,,,,WOS:000281955000007,,,,,
J,"Acemoglu, D; Dahleh, MA; Lobel, I; Ozdaglar, A",,,,"Acemoglu, Daron; Dahleh, Munther A.; Lobel, Ilan; Ozdaglar, Asuman",,,Bayesian Learning in Social Networks,REVIEW OF ECONOMIC STUDIES,,,,,,,,,,,,"We study the (perfect Bayesian) equilibrium of a sequential learning model over a general social network. Each individual receives a signal about the underlying state of the world, observes the past actions of a stochastically generated neighbourhood of individuals, and chooses one of two possible actions. The stochastic process generating the neighbourhoods defines the network topology. We characterize pure strategy equilibria for arbitrary stochastic and deterministic social networks and characterize the conditions under which there will be asymptotic learning-convergence (in probability) to the right action as the social network becomes large. We show that when private beliefs are unbounded (meaning that the implied likelihood ratios are unbounded), there will be asymptotic learning as long as there is some minimal amount of ""expansion in observations"". We also characterize conditions under which there will be asymptotic learning when private beliefs are bounded.",,,,,,,,,,,,,,,,,0034-6527,,,,,OCT,2011,78,4,,,,,1201,1236,,10.1093/restud/rdr004,,,,,,,WOS:000296132900002,,,,,
J,"Bramoulle, Y; Kranton, R",,,,"Bramoulle, Yann; Kranton, Rachel",,,Public goods in networks,JOURNAL OF ECONOMIC THEORY,,,,,,,,,,,,"This paper considers incentives to provide goods that are non-excludable along social or geographic links. We find, first, that networks can lead to specialization in public good provision. In every social network there is an equilibrium where some individuals contribute and others free ride. In many networks, this extreme is the only outcome. Second, specialization can benefit society as a whole. This outcome arises when contributors are linked, collectively, to many agents. Finally, a new link increases access to public goods, but reduces individual incentives to contribute. Hence, overall welfare can be higher when there are holes in a network. (c) 2006 Elsevier Inc. All rights reserved.",,,,,,,,,,,,,,,,,0022-0531,,,,,JUL,2007,135,1,,,,,478,494,,10.1016/j.jet.2006.06.006,,,,,,,WOS:000248395200022,,,,,
J,"Kremer, M; Miguel, E",,,,"Kremer, Michael; Miguel, Edward",,,The illusion of sustainability,QUARTERLY JOURNAL OF ECONOMICS,,,,,,,,,,,,"We use a randomized evaluation of a Kenyan deworming program to estimate peer effects in technology adoption and to shed light on foreign aid donors' movement towards sustainable community provision of public goods. Deworming is a public good since much of its social benefit comes through reduced disease transmission. People were less likely to take deworming if their direct first-order or indirect second-order social contacts were exposed to deworming. Efforts to replace subsidies with sustainable worm control measures were ineffective: a drug cost-recovery program reduced take-up 80 percent; health education did not affect behavior, and a mobilization intervention failed. At least in this context, it appears unrealistic for a one-time intervention to generate sustainable voluntary local public goods provision.",,,,,"Miguel, Edward/0000-0001-6927-709X",,,,,,,,,,,,0033-5533,1531-4650,,,,AUG,2007,122,3,,,,,1007,1065,,10.1162/qjec.122.3.1007,,,,,,,WOS:000248618600004,,,,,
J,"Potts, J; Cunningham, S; Hartley, J; Ormerod, P",,,,"Potts, Jason; Cunningham, Stuart; Hartley, John; Ormerod, Paul",,,Social network markets: a new definition of the creative industries,JOURNAL OF CULTURAL ECONOMICS,,,,,,,,,,,,"We propose a new definition of the creative industries in terms of social network markets. The extant definition of the creative industries is based on an industrial classification that proceeds in terms of the creative nature of inputs and the intellectual property nature of outputs. We propose, instead, a new market-based definition in terms of the extent to which both demand and supply operate in complex social networks. We review and critique the standard creative industries definitions and explain why we believe a market-based social network definition offers analytic advance. We discuss some empirical, analytic and policy implications of this new definition.",,,,"potts, jason/L-6530-2015; Hartley, John/R-6361-2019","potts, jason/0000-0003-1468-870X; Hartley, John/0000-0001-5987-8190; Cunningham, Stuart/0000-0002-7437-1424",,,,,,,,,,,,0885-2545,,,,,SEP,2008,32,3,,,,,167,185,,10.1007/s10824-008-9066-y,,,,,,,WOS:000258656100001,,,,,
