PT,AU,BA,BE,GP,AF,BF,CA,TI,SO,SE,BS,LA,DT,CT,CY,CL,SP,HO,DE,ID,AB,C1,RP,EM,RI,OI,FU,FX,CR,NR,TC,Z9,U1,U2,PU,PI,PA,SN,EI,BN,J9,JI,PD,PY,VL,IS,PN,SU,SI,MA,BP,EP,AR,DI,D2,EA,PG,WC,SC,GA,UT,PM,OA,HC,HP,DA
J,"Tubadji, A; Nijkamp, P",,,,"Tubadji, Annie; Nijkamp, Peter",,,Cultural impact on regional development: application of a PLS-PM model to Greece,ANNALS OF REGIONAL SCIENCE,,,,,,,,,,,,"This paper seeks to find evidence for the impact of local culture-living culture and cultural heritage-on regional socio-economic development in Greece. The main aim of the paper is to operationalize the culture-based development hypothesis for the existence of a cumulative causation process of cultural impact on Greek local development. To test this hypothesis empirically, we employ an original and uniquely compiled dataset of over 130 economic and social indicators about Greece on a NUTS3 level, assembled from various international and local sources. Employing a combined nonparametric partial-least squares path modelling approach, we find evidence that-in contrast to results from other European countries and the USA-in Greece, culture influences not only the human capital, but also the overall labour force structure. This appears to affect not only the economic productivity, but also the overall quality of life in the locality concerned. These results, based on nonparametric estimations, were confirmed through triangulation with parametric 3SLS and structural equation model tests. The latter use of parametric and nonparametric techniques in a mutually complementary manner is one of the novelties in this contribution.",,,,,,,,,,,,,,,,,0570-1864,1432-0592,,,,MAY,2015,54,3,,,,,687,720,,10.1007/s00168-015-0672-2,,,,,,,WOS:000363061000002,,,,,
J,"Kruckenberg, LJ",,,,"Kruckenberg, Lena J.",,,Renewable energy partnerships in development cooperation: Towards a relational understanding of technical assistance,ENERGY POLICY,,,,,,,,,,,,"Recent decades have witnessed a surge in international programmes established to assist the adoption of renewable energy technologies (RETs) in low and lower-middle income countries. So far, such programmes have yielded mixed success. While partnerships between international, national and local organisations have become the pre-eminent model for RET programmes, we know relatively little about their contribution. This article traces the role of renewable energy partnerships in development cooperation, shifting the analytical emphasis from barriers and drivers to key actors and their relationships. It presents a relational approach for the analysis of development assistance for renewable energy, drawing on theories concerning the role of strong and weak ties in inter-organisational networks. Through an analysis of seven empirical cases from Central America, the article provides insights into how different forms of inter-organisational relationships can facilitate implementation of RET programmes but do not necessarily enhance the capacities of local organisations in a way to support a more sustainable adoption of RETs. On the basis of this analysis, theoretical and policy implications are given concerning the potential of relational approaches for researching technology diffusion processes, and the role of strong and weak ties for the success - or failure - of renewable energy partnerships. (C) 2014 Elsevier Ltd. All rights reserved.",,,,,,,,,,,,,,,,,0301-4215,1873-6777,,,,FEB,2015,77,,,,,,11,20,,10.1016/j.enpol.2014.11.004,,,,,,,WOS:000349507900002,,,,,
J,"McVicar, D; Polanski, A",,,,"McVicar, Duncan; Polanski, Arnold",,,Peer Effects in UK Adolescent Substance Use: Never Mind the Classmates?,OXFORD BULLETIN OF ECONOMICS AND STATISTICS,,,,,,,,,,,,"This article estimates peer influences on the alcohol, tobacco and cannabis use of UK adolescents. We present evidence of large, positive and statistically significant peer effects in all three behaviours when classmates are taken as the reference group. We also find large, positive and statistically significant associations between own substance use and friends' substance use. When both reference groups are considered simultaneously, the influence of classmates either disappears or is much reduced, whereas the association between own and friends' behaviours does not change. The suggestion is that classmate behaviour is primarily relevant only inasmuch as it proxies for friends' behaviour.",,,,,,,,,,,,,,,,,0305-9049,1468-0084,,,,AUG,2014,76,4,,,,,589,604,,10.1111/obes.12030,,,,,,,WOS:000339101200006,,,,,
J,"Molina-Morales, FX; Exposito-Langa, M",,,,"Xavier Molina-Morales, F.; Exposito-Langa, Manuel",,,Overcoming Undesirable Knowledge Redundancy in Territorial Clusters,INDUSTRY AND INNOVATION,,,,,,,,,,,,"This work analyzes the existence of redundant knowledge associated with geographic networks of firms. Specifically, our research focuses on how firms can avoid inefficient redundancy ties derived from territorial clusters. We propose that firms embedded in a dense and strong-tie network generate redundant knowledge flows. However, they may use structural dispersion to mediate and overcome this limitation. Our empirical study was conducted drawing on the Spanish ceramic tile industrial cluster to test the potential association between social capital and redundancy. Our findings support the idea that structural dispersion mediates the effects of strong ties and the generation of knowledge redundancy.",,,,"Exposito-Langa, Manuel/H-5142-2015; Molina-Morales, F. Xavier/H-1933-2015","Exposito-Langa, Manuel/0000-0001-7707-7354; Molina-Morales, F. Xavier/0000-0001-9078-4782",,,,,,,,,,,,1366-2716,1469-8390,,,,Nov 1,2013,20,8,,,,,739,758,,10.1080/13662716.2013.856622,,,,,,,WOS:000327585200004,,,,,
J,"Casey, C",,,,"Casey, Colleen",,,Low-Wealth Minority Enterprises and Access to Financial Resources for Start-Up Activities: Do Connections Matter?,ECONOMIC DEVELOPMENT QUARTERLY,,,,,,,,,,,,"The role new start-ups may play in the economic recovery has been thrust into the political limelight, with a number of policy makers and advocates calling for network interventions to stimulate and foster an environment conducive to their growth and development. However, the design and implementation of these policies may have differential effects for low-wealth minority enterprises. In this article, the author draws on social resource theory to conceptualize the effects of social networks on access to financial resources. The findings suggest that disparities do exist among low-wealth minority enterprises in the amount of social resources they possess as well as in the formal financial resources obtained. Low-wealth minority enterprises that do obtain a higher level of formal financial resources have upward connections to those that possess greater social resources. The research has implications for the design and implementation of policies geared toward low-wealth minority entrepreneurs.",,,,"casey, colleen/B-1669-2013","casey, colleen/0000-0003-3579-3875",,,,,,,,,,,,0891-2424,1552-3543,,,,AUG,2012,26,3,,,,,252,266,,10.1177/0891242412452446,,,,,,,WOS:000306525500005,,,,,
J,"Groysberg, B; Lee, LE",,,,"Groysberg, Boris; Lee, Linda-Eling",,,Star power: colleague quality and turnover,INDUSTRIAL AND CORPORATE CHANGE,,,,,,,,,,,,"In this article, we argue that the existence of greater organizational resources, in the form of higher quality colleagues, acts as a retention mechanism. We test our hypotheses using a panel data set of securities analysts in 24 securities firms over a 9-year period. Results show that analysts working with higher quality colleagues are less likely to turnover. Analyst turnover is affected by the performance of two types of colleagues: colleagues within one's group and colleagues in the client-facing role. This ""colleague effect"" applies to analyst turnover to competitor firms and not to analysts who exit the securities analysts industry.",,,,,,,,,,,,,,,,,0960-6491,,,,,JUN,2010,19,3,,,,,741,765,,10.1093/icc/dtp049,,,,,,,WOS:000279110200005,,,,,
J,"Barros, CP; Santos, CM",,,,"Barros, Carlos Pestana; Santos, Carlos M.",,,Earnings of hotel managers: comparing the human and social capital approach,TOURISM ECONOMICS,,,,,,,,,,,,"This paper estimates a human capital model for hotel managers and compares the results with the social capital model, based on a questionnaire distributed in Portugal in 2003. The study disentangles the relative contributions of the two competing theories of earnings, the human capital and social capital theories, as applied to hotel managers. The authors conclude that hotel managers I earnings are a function of both theories. Policy implications are derived.",,,,"Barros, carlos/B-5875-2009","Santos, Carlos/0000-0003-2421-5201; Barros, Carlos/0000-0002-5863-2874",,,,,,,,,,,,1354-8166,,,,,MAR,2009,15,1,,,,,87,103,,10.5367/000000009787536762,,,,,,,WOS:000264314000004,,,,,
J,"Deumert, A; Mabandla, N",,,,"Deumert, Ana; Mabandla, Nkululeko",,,"I-Dollar EYI One! -Ethnolinguistic Fractionalisation, Communication Networks and Economic Participation-Lessons from Cape Town, South Africa",JOURNAL OF DEVELOPMENT STUDIES,,,,,"Conference on Accelerated and Shared Growth in South Africa - Determinants, Constraints and Opportunities","Oct, 2006","Johannesburg, SOUTH AFRICA","DPRU, TIPS",,,,"The relationship between ethnolinguistic fractionalisation and development has long been of interest to economists and linguists. While econometric analyses have shown relatively stable interactions between high levels of fractionalisation and low indices of development, the mechanisms underlying this relationship are still unclear. This paper explores the importance of fragmented versus unified communication networks for socio-economic development, using data from Cape Town, South Africa. Like other cities in low- and middle-income countries, Cape Town shows growing linguistic diversity due to high levels of rural-urban migration. Two aspects of the city's economy will be discussed on the basis of specialised survey data and anthropological fieldwork: (a) the labour market, and (b) informal entrepreneurial activities. The analysis shows the importance of language as an explanatory variable in the study of economic life, and allows us to advance our understanding of human and social capital formation in ethnolinguistically fragmented societies. In the conclusion the authors discuss the policy implications of the study.",,,,,,,,,,,,,,,,,0022-0388,1743-9140,,,,,2009,45,3,,,,,412,440,PII 908859158,10.1080/00220380802582353,,,,,,,WOS:000263554100007,,,,,
S,"Hansen, HK; Asheim, B; Vang, J",,"Kong, L; OConnor, J",,"Hansen, Hogni Kalso; Asheim, Bjorn; Vang, Jan",,,The European Creative Class and Regional Development: How Relevant Is Florida's Theory for Europe?,"CREATIVE ECONOMIES, CREATIVE CITIES: ASIAN-EUROPEAN PERSPECTIVES",Geojournal Library,,,,,,,,,,,,,,,"Hansen, Hogni Kalso/E-5382-2014","Hansen, Hogni Kalso/0000-0001-6174-1417",,,,,,,,,,,,0924-5499,,978-1-4020-9949-6,,,,2009,98,,,,,,99,120,,10.1007/978-1-4020-9949-6_7,10.1007/978-1-4020-9949-6,,,,,,WOS:000269885300007,,,,,
J,"Sanchez-Moral, S",,,,"Sanchez-Moral, Simon",,,Industrial Clusters and New Firm Creation in the Manufacturing Sector of Madrid's Metropolitan Region,REGIONAL STUDIES,,,,,,,,,,,,"Sanchez Moral S. Industrial clusters and new firm creation in the manufacturing sector of Madrid's metropolitan region, Regional Studies. In Madrid, as in other metropolitan regions, the interest in the agglomeration of economic activities, along with the present perspectives of metropolitan competitiveness and the emerging knowledge-based economy, converge on the field of industrial clusters. This paper follows the current recommendations about combining mapping strategies. Firstly, with a quantitative identification of industrial complexes in the region, considering as an initial hypothesis the existence of significant input-output relationships among co-located industries. Secondly, the qualitative information from politically selected clusters was used to refine the quantitative cluster identification and to evaluate the creation of new firms within Madrid's manufacturing clusters.",,,,"Sanchez-Moral, Simon/H-3701-2015","Sanchez-Moral, Simon/0000-0001-6381-2653",,,,,,,,,,,,0034-3404,,,,,,2009,43,7,,,,,949,965,PII 901326554,10.1080/00343400801932326,,,,,,,WOS:000268387100006,,,,,
B,"Geddes, M",,"Considine, M; Giguere, S",,"Geddes, Mike",,,Government and Communities in Partnerships in England: The Empire Strikes Back?,THEORY AND PRACTICE OF LOCAL GOVERNANCE AND ECONOMIC DEVELOPMENT,,,,,,,,,,,,,,,,,,,,,,,,,,,,,,,978-0-23058-268-2,,,,2008,,,,,,,100,125,,,10.1057/9780230582682,,,,,,WOS:000283499100007,,,,,
B,"Boschma, RA; Frenken, K",,"Frenken, K",,"Boschma, Ron A.; Frenken, Koen",,,Introduction: applications of evolutionary economic geography,APPLIED EVOLUTIONARY ECONOMICS AND ECONOMIC GEOGRAPHY,,,,,4th European Meeting on Applied Evolutionary Economics,"MAY 19-21, 2005","Utrecht, NETHERLANDS",,,,,,,,,"Frenken, Koen/C-4486-2017","Frenken, Koen/0000-0003-4731-0201",,,,,,,,,,,,,,978-1-84542-845-7,,,,2007,,,,,,,1,24,,,,,,,,,WOS:000286369600002,,,,,
B,"Waters, N",,"Reggiani, A; Nijkamp, P",,"Waters, Nigel",,,Network and nodal indices - Measures of complexity and redundancy: A review,"SPATIAL DYNAMICS, NETWORKS AND MODELLING",New Horizons in Regional Science,,,,7th World Congress of the Regional-Science-Association-International,"APR 13-17, 2004","Port Elizabeth, SOUTH AFRICA",Reg Sci Assoc Int,,,,,,,,,,,,,,,,,,,,,,,1-84542-450-6,,,,2006,,,,,,,13,33,,,,,,,,,WOS:000241776100002,,,,,
S,"Fritsch, M",,"Koschatzky, K; Kulicke, M; Zenker, A",,"Fritsch, M",,,Innovation by networking: An economic perspective,INNOVATION NETWORKS: CONCEPTS AND CHALLENGES IN THE EUROPEAN PERSPECTIVE,TECHNOLOGY INNOVATION AND POLICY,,,,Conference on Innovation Networking,"Nov, 1999","KARLSRUHE, GERMANY","Fed Minist Educ & Res, Fraunhofer Inst Syst & Innovat Res",,,,,,,,,,,,,,,,,,,,,1431-9667,,3-7908-1382-6,,,,2001,12,,,,,,25,34,,,,,,,,,WOS:000177769500002,,,,,
B,"Fritsch, M; Werker, C",,"Fritsch, M; Brezinski, H",,"Fritsch, M; Werker, C",,,Innovation systems in transition,INNOVATION AND TECHNOLOGICAL CHANGE IN EASTERN EUROPE: PATHWAYS TO INDUSTRIAL RECOVERY,,,,,Conference on Innovation and Transformation,1996,"TECH UNIV BERGAKAD FREIBERG, FREIBERG, GERMANY",,TECH UNIV BERGAKAD FREIBERG,,,,,,,,,,,,,,,,,,,,,,1-84064-256-4,,,,1999,,,,,,,5,22,,,,,,,,,WOS:000166857300002,,,,,
J,"Dilmaghani, M",,,,"Dilmaghani, Maryam",,,Civic participation of secular groups in Canada,REVIEW OF SOCIAL ECONOMY,,,,,,,,,,,,"Using two recent nationally representative Canadian surveys, this paper investigates how secularization affects civic participation, inclusive of political engagement and philanthropy. Three mutually exclusive categories of secularized individuals are considered. The analysis suggests that Canadian secular groups are relatively less engaged with politics and volunteer fewer hours, compared with the actively religious. They are, however, found to contribute significantly more money to secular causes, controlling for a wide range of individual attributes. Various explanations are explored.",,,,,,,,,,,,,,,,,0034-6764,1470-1162,,,,,2017,75,4,,,,,523,543,,10.1080/00346764.2017.1299203,,,,,,,WOS:000424618800009,,,,,
J,"Pike, S; Lubell, M",,,,"Pike, Susan; Lubell, Mark",,,Geography and social networks in transportation mode choice,JOURNAL OF TRANSPORT GEOGRAPHY,,,,,,,,,,,,"In this paper we explore the effects of social influence on travel behavior and utilize an instrumental variables approach to address the potential endogeneity related to similarities in the choice environments of socially connected individuals. We expect individuals to use a mode of transportation that is used by others in their social network. However, other factors important to mode choice, such as commute characteristics or transit access, may influence multiple members of a social network at the same time. Thus it is necessary to estimate the effects of social influence while taking into account the potential effects of shared environmental characteristics. We hypothesize that social influence is relevant to transportation mode choice, even when accounting for shared environmental characteristics among members of a social network. We explore this hypothesis, utilizing survey data collected from a sample of university students, in Davis California. The survey collected information about respondents' social networks, the transportation mode choices of their social contacts, and geographic information for the respondent and their social network We estimate models using instrumental variables measuring neighborhood characteristics of the social contacts. Results provide evidence that social processes are important to travel behavior, even when accounting for similarities in behavior that may be attributed to similar choice environments. (C) 2016 Elsevier Ltd. All rights reserved.",,,,,"Pike, Susan/0000-0001-6558-3479",,,,,,,,,,,,0966-6923,1873-1236,,,,DEC,2016,57,,,,,,184,193,,10.1016/j.jtrangeo.2016.10.009,,,,,,,WOS:000390509600017,,,,,
J,"Hauge, JA; Chimahusky, S",,,,"Hauge, Janice A.; Chimahusky, Stanley",,,ARE PROMISES MEANINGLESS IN AN UNCERTAIN CROWDFUNDING ENVIRONMENT?,ECONOMIC INQUIRY,,,,,,,,,,,,"We use a prominent crowdfunding organization, Kickstarter, to analyze the factors that determine timeliness of delivery of rewards to financial backers. We seek to determine the extent to which promised rewards are delivered on time and to characterize projects that have stronger likelihood of timely delivery of rewards. We find that lateness commonly occurs, yet cannot be explained universally with any given set of project characteristics, implying that the uncertainty of rewards involved with crowdfunding entities is difficult to overcome.",,,,,,,,,,,,,,,,,0095-2583,1465-7295,,,,JUL,2016,54,3,,,,,1621,1630,,10.1111/ecin.12319,,,,,,,WOS:000375942500015,,,,,
J,"Dufva, M; Ahlqvist, T",,,,"Dufva, Mikko; Ahlqvist, Toni",,,Elements in the construction of future-orientation: A systems view of foresight,FUTURES,,,,,,,,,,,,"Foresight is currently perceived as a critical activity in the development of innovation policies and corporate strategies. While there are many descriptions of the benefits of foresight, there is little research into how these benefits are created. In addition, although the view of innovations has shifted towards a systems understanding, the same has not happened with foresight, which is largely seen as a process. The process view and focus on the outcomes has created a situation where the dynamics between agents involved in foresight is still not well understood. One emerging approach to improve the understanding of the dynamics of foresight, and to embed foresight more closely with innovation management and policy, is the systems view. In this paper, we build on the systems view of foresight, and study what the elements in foresight as a system are and how they contribute to the creation of futures knowledge. Based on the literature, we propose six elements that are useful for understanding a foresight system and the creation of futures knowledge: agents, cognitive schemes, strategic objects, mediating events, memory objects and metaphors. We illustrate the systems view, the elements and their interaction with two case examples: one on creating future-orientation in a research and technology organisation and one on renewing a forest industry through roadmapping. Based on the elements and the case studies, we argue that the strategic objects and mediating events are important leverage points when steering foresight as a system. (C) 2015 Elsevier Ltd. All rights reserved.",,,,"Dufva, Mikko/H-3762-2019","Dufva, Mikko/0000-0001-7513-4044",,,,,,,,,,,,0016-3287,1873-6378,,,,OCT,2015,73,,,,,,112,125,,10.1016/j.futures.2015.08.006,,,,,,,WOS:000366234900010,,,,,
J,"Changwony, FK; Campbell, K; Tabner, IT",,,,"Changwony, Frederick K.; Campbell, Kevin; Tabner, Isaac T.",,,Social Engagement and Stock Market Participation*,REVIEW OF FINANCE,,,,,,,,,,,,"We investigate the separate and joint influences of social engagement measures on stock market participation and find that socially engaged individuals are more likely to participate. Consistent with Granovetter's theory of social networks we find that a weak tie (measured by social group involvement) has a positive effect on stock market participation whereas a strong tie (measured by frequency of talking to neighbors) has no effect. More trusting individuals are more likely to participate in the stock market, as are those who identify with a political party. In contrast, the degree to which religion is important appears to have little impact.",,,,,"Campbell, Kevin/0000-0003-4239-8590; Changwony, Frederick/0000-0003-0015-5224",,,,,,,,,,,,1572-3097,1573-692X,,,,MAR,2015,19,1,,,,,317,366,,10.1093/rof/rft059,,,,,,,WOS:000351525900008,,,,,
J,"Nordman, CJ; Pasquier-Doumer, L",,,,"Nordman, Christophe J.; Pasquier-Doumer, Laure",,,Transitions in a West African labour market: The role of family networks,JOURNAL OF BEHAVIORAL AND EXPERIMENTAL ECONOMICS,,,,,,,,,,,,"This paper sheds light on the role of family networks in the dynamics of a West African labour market, i.e. in the transitions from unemployment to employment, from wage employment to self-employment, and from self-employment to wage employment. It investigates the effects of three dimensions of family networks on these transitions: their structure, the strength of their ties, and the resources embedded in them. For this purpose, we use a first-hand survey conducted in Ouagadougou on a representative sample of 2000 households. Using event history data and very detailed information on family networks, we estimate proportional hazard models for discrete-time data. We find that family networks have a significant effect on the dynamics of workers in the labour market and that this effect differs depending on the type of transition and the dimension of the family network considered. Network size appears not to matter much in labour market dynamics. However, strong ties play a stabilizing role by limiting large transitions. Their negative effect on transitions is reinforced by a high level of resources embedded in the network. (C) 2014 Published by Elsevier Inc.",,,,,"Nordman, Christophe Jalil/0000-0002-8368-4086",,,,,,,,,,,,2214-8043,2214-8051,,,,FEB,2015,54,,,,,,74,85,,10.1016/j.socec.2014.11.008,,,,,,,WOS:000352049400009,,,,,
J,"Oh, Y; Lee, IW; Bush, CB",,,,"Oh, Youngmin; Lee, In Won; Bush, Carrie Blanchard",,,The Role of Dynamic Social Capital on Economic Development Partnerships Within and Across Communities,ECONOMIC DEVELOPMENT QUARTERLY,,,,,,,,,,,,"Various types of social capital facilitate the creation of intralocal or interlocal economic development partnerships because it reduces the transaction costs that lead to collective action problems. Prior studies have focused on explaining how collective action mechanisms lead to the creation of economic development partnerships. While multidimensional social capital plays a dynamic role in promoting economic development activities within and across communities, the underlying complexity of multidimensional social capital remains unexplored in prior studies. This study creates a typology presenting various dimensions of social capital and tests the effects of multidimensional social capital on different economic development partnerships. Results indicate that different dimensions of social capital contribute to creating economic development partnerships regardless of local boundaries.",,,,,,,,,,,,,,,,,0891-2424,1552-3543,,,,AUG,2014,28,3,,,,,230,243,,10.1177/0891242414535247,,,,,,,WOS:000343035600005,,,,,
J,"Ramirez, S; Dwivedi, P; Ghilardi, A; Bailis, R",,,,"Ramirez, Sebastian; Dwivedi, Puneet; Ghilardi, Adrian; Bailis, Robert",,,Diffusion of non-traditional cookstoves across western Honduras: A social network analysis,ENERGY POLICY,,,,,,,,,,,,"A third of the world's population uses inefficient biomass stoves, contributing to severe health problems, forest degradation, and climate change. Clean burning, fuel-efficient, non-traditional cookstoves (NTCS) are a promising solution; however, numerous projects fail during the diffusion process. We use social network analysis to reveal patterns driving a successful stove intervention in western Honduras. The intervention lacks formal marketing, but has spread across a wide area in just a few years. To understand the process, we map the soCial network of active community members who drove diffusion across a large swath of the country. We find that most ACMs heard about stoves twice before sharing information about it with others and introducing the stove into their own communities. On average, the social distance between ACMs and the project team is 3 degrees of separation. Both men and women are critical to the diffusion process, but men tend to communicate over longer distances, while women principally communicate over shorter distances. Government officials are also crucial to diffusion. Understanding how information moves through social networks and across geographic space allows us to theorize how knowledge about beneficial technologies spreads in the absence of formal marketing and inform policies for NTCS deployment worldwide. (C) 2013 Elsevier Ltd. All rights reserved.",,,,"Bailis, Robert/O-6643-2019; Bailis, Rob/B-9779-2015; Ghilardi, Adrian/P-9585-2017","Bailis, Robert/0000-0002-4111-3760; Bailis, Rob/0000-0002-4111-3760; Ghilardi, Adrian/0000-0002-7286-0670; Dwivedi, Puneet/0000-0001-6272-7473",,,,,,,,,,,,0301-4215,1873-6777,,,,MAR,2014,66,,,,,,379,389,,10.1016/j.enpol.2013.11.008,,,,,,,WOS:000332135900034,,,,,
